{
  "approval_id": "APR-WIS-REV-001-001",
  "task_id": "WIS-REV-001",
  "action": "send_message",
  "impact": "Enviar un mensaje real a un prospecto fuera de WIS.",
  "evidence": ["Borrador revisado por QA"],
  "requested_at": "2026-09-26T13:30:00Z",
  "decision": "PENDING",
  "decided_at": null,
  "decided_by": null
}

